id,variant,tags,tier,rarity,fleet pts,op cost,formation,range,attackRunRange,attackPositionOffset,num,role,role desc,refit,base value,,,,,,,,,,,,,number
fsdf_excalibur_wing,fsdf_rastaban_mrm,"no_drop, no_sell",0,,0,0,BOX,0,0,,2,SUPPORT,Loitering Munition,6,0,,,,,,,,,,,,,711000
fsdf_aldibain_wing,fsdf_aldibain_Fighter,"fsdf_package_bp, fighter, fighter3, rapid_reform, leader_no_swarm, wingmen_no_swarm, attack_at_an_angle ",1,,6,14,V,6000,1200,100,4,INTERCEPTOR,Fighter,10,9000,,,,,,,,,,,,,711000
fsdf_tianyi_wing,fsdf_tianyi_Fighter,"fsdf_package_bp, interceptor, interceptor3, rapid_reform, leader_no_swarm, wingmen_no_swarm, attack_at_an_angle ",3,,7,16,BOX,6000,300,300,2,FIGHTER,Support Fighter,15,12500,,,,,,,,,,,,,
fsdf_eldsich_wing,fsdf_eldsich_Fighter,"fsdf_package_bp, bomber, bomber3, rapid_reform, leader_no_swarm, wingmen_no_swarm, attack_at_an_angle ",2,,8,20,CLAW,6000,1200,600,1,BOMBER,Bomber,18,15000,,,,,,,,,,,,,711000
,,,,,,,,,,,,,,,,,,,,,,,,,,,,
